<?xml version="1.0" encoding="UTF-8"?>
<!--Sample XML file generated by XMLSpy v2012 rel. 2 sp1 (http://www.altova.com)-->
<instructionSet xsi:noNamespaceSchemaLocation="instructionSet.xsd" xmlns:xsi="http://www.w3.org/2001/XMLSchema-instance">
	<instructionSetName>MultiChoice Instruction Set Demo</instructionSetName>
	<version>1.0</version>
	<author>Romeo Dickason</author>
	<instructionSetDescription>Will draw an image as per the project specification. See image 1.1.</instructionSetDescription>
	<commands>
		<command>
			<commandDescription>Draw line 1</commandDescription>
			<actions>
				<action>
					<turn>
						<direction>right</direction>
						<angle>90</angle>
					</turn>
				</action>
				<action>
					<move>
						<direction>forward</direction>
						<distance>500</distance>
					</move>
				</action>
			</actions>
		</command>
		<command>
			<commandDescription>Draw line 2</commandDescription>
			<actions>
				<action>
					<turn>
						<direction>left</direction>
						<angle>150</angle>
					</turn>
				</action>
				<action>
					<move>
						<direction>forward</direction>
						<distance>577.35</distance>
					</move>
				</action>
			</actions>
		</command>
		<command>
			<commandDescription>Draw line 3</commandDescription>
			<actions>
				<action>
					<turn>
						<direction>right</direction>
						<angle>150</angle>
					</turn>
				</action>
				<action>
					<move>
						<direction>forward</direction>
						<distance>500</distance>
					</move>
				</action>
			</actions>
		</command>
		<command>
			<commandDescription>Draw line 4</commandDescription>
			<actions>
				<action>
					<turn>
						<direction>left</direction>
						<angle>135</angle>
					</turn>
				</action>
				<action>
					<move>
						<direction>forward</direction>
						<distance>353.55</distance>
					</move>
				</action>
			</actions>
		</command>
		<command>
			<commandDescription>Draw line 5</commandDescription>
			<actions>
				<action>
					<turn>
						<direction>left</direction>
						<angle>90</angle>
					</turn>
				</action>
				<action>
					<move>
						<direction>forward</direction>
						<distance>353.55</distance>
					</move>
				</action>
			</actions>
		</command>
		<command>
			<commandDescription>Draw line 6</commandDescription>
			<actions>
				<action>
					<turn>
						<direction>left</direction>
						<angle>45</angle>
					</turn>
				</action>
				<action>
					<move>
						<direction>forward</direction>
						<distance>288.68</distance>
					</move>
				</action>
			</actions>
		</command>	
		<command>
			<commandDescription>Draw line 7</commandDescription>
			<actions>
				<action>
					<turn>
						<direction>left</direction>
						<angle>120</angle>
					</turn>
				</action>
				<action>
					<move>
						<direction>forward</direction>
						<distance>577.35</distance>
					</move>
				</action>
			</actions>
		</command>		
		<command>
			<commandDescription>Draw line 8</commandDescription>
			<actions>
				<action>
					<turn>
						<direction>right</direction>
						<angle>120</angle>
					</turn>
				</action>
				<action>
					<move>
						<direction>forward</direction>
						<distance>288.68</distance>
					</move>
				</action>
			</actions>
		</command>				
	</commands>
</instructionSet>
